{
  "id": "brief.2020_q1_pandemic",
  "name": "brief.2020_q1_pandemic.name",
  "desc": "brief.2020_q1_pandemic.desc",
  "scenarios": [
    {
      "scenario_type": "raise",
      "name": "brief.2020_q1_pandemic.raise.name",
      "forecast": {
        "inflation_outlook": 0.012,
        "unemployment_outlook": 0.13,
        "growth_outlook": -0.09
      }
    },
    {
      "scenario_type": "hold",
      "name": "brief.2020_q1_pandemic.hold.name",
      "forecast": {
        "inflation_outlook": 0.015,
        "unemployment_outlook": 0.115,
        "growth_outlook": -0.07
      }
    },
    {
      "scenario_type": "lower",
      "name": "brief.2020_q1_pandemic.lower.name",
      "forecast": {
        "inflation_outlook": 0.019,
        "unemployment_outlook": 0.095,
        "growth_outlook": -0.05
      }
    }
  ]
}
