{
  "id": "brief.2008_q4_crisis",
  "name": "brief.2008_q4_crisis.name",
  "desc": "brief.2008_q4_crisis.desc",
  "scenarios": [
    {
      "scenario_type": "raise",
      "name": "brief.2008_q4_crisis.raise.name",
      "forecast": {
        "inflation_outlook": 0.025,
        "unemployment_outlook": 0.085,
        "growth_outlook": -0.035
      },
      "target_rate": 0.03
    },
    {
      "scenario_type": "hold",
      "name": "brief.2008_q4_crisis.hold.name",
      "forecast": {
        "inflation_outlook": 0.032,
        "unemployment_outlook": 0.078,
        "growth_outlook": -0.025
      },
      "target_rate": 0.02
    },
    {
      "scenario_type": "lower",
      "name": "brief.2008_q4_crisis.lower.name",
      "forecast": {
        "inflation_outlook": 0.04,
        "unemployment_outlook": 0.07,
        "growth_outlook": -0.015
      },
      "target_rate": 0.005
    }
  ]
}
